test_touch	1a/1b	Console logs of touch events for understanding the api (via remote debugging)
test_color	1	Color picker: by touch controls by coordinates of screen
test_color	2a	Color picker: experimentation of circle wheel picker
test_color	2b	tweaking size
test_color	2c	playing around with animation
test_color	2d	uses canvas image data
test_color	2e	test touch
test_color	2f	tweaking touch ui
test_swipe	1	testing algorithm for a swipe up gesture
test_color	2g	resizing color picker for adapt screensizes